station,chunk_id,start_ts,end_ts,status,transcript_id,asr_duration_ms,transcript
wbap-am-820,76918,1782200856.7542737,1782200946.7542737,done,26731,4258,was in the NHS and their health care system that are saying this is dangerous this cannot continue this is costing people their lives not going to change you think of margaret thatcher at some point you're gonna run out of other people's money apparently that's not happening they're still doing it and so what do they do they take more of other people's money that guy that guy i know from great britain was happy they were raising taxes on fuel because he thought it was going to be a better NHS system after those those taxes were raised and of course it hasn't changed we are redeye radio more with gary mctemera and eric harley it's redeye radio listen to redeye radio wherever you are with the redeye radio app available on android and iphone download it now from the app store or by visiting us at redeye radioshow.com if you drive a big rig you know that more time on the road means more money in your pocket shellrotella with advanced synthetic technology is designed to help keep your rig running and save you money in the long run trade up to shellrotella and you'll get superior protection against engine wear that means less time in the shop and more time on the road it also means you'll get more chances to see north america's finest roadside attractions
klif-am-570,76917,1782200794.951602,1782200884.951602,done,26730,5688,"But he was not lying to you, though, was he? He wasn't there. That's the thing. This officer swore he was at our house the night before, when I had had that dream, but he wasn't. It was just a dream, or was it? Or was it? Or was it? I'll never know. I don't think to this day. So I believe that there were two timelines happening. They merged in that moment, in that vortex, in Sedona, and that officer swore he was there the night before, but George, there was no trace of that on my phone. I know I didn't call the night before. I called that night. Are you saying the officer might be wrong? I think the officer came to confirm that other timeline of reality for us. Maybe you called him in a different dimension. Yes, maybe. Because there was no record of it on my phone, that's for sure. And he thought we were out of our mind, calling him two nights in a row, when I know for a fact my physical body and my physical experience did not call him the night before. But I don't think he'd make it up if it didn't happen. I agree. I agree. But it didn't happen in my reality. So that was terrifying. And what I realized is, even though that experience was so terrifying, it brought me into this personal relationship with Jesus, because that's when I started calling on him, was at the height of my fear."
wbap-am-820,76916,1782200687.7170599,1782200777.7170599,done,26729,4505,just like camera we're going by that right transgender language law that they want to uh... and then when i was in construct a thing to me about doing ancestry isn't it really isn't about the people in the family i didn't know him he didn't know me clearly hundreds of years ago i'd and i had no idea what kind of person he was like it was just to me it's the history of all as you read through their lives and then you're just reading through someone's life whether they were related to you or not really is a relevant doesn't really mean anything at all it just it but it eight when i found that out i thought this is it there's deep in this culture and it won't ever change it's you know they've made a couple of moves like brexit it's a day we want representation but of course it means something else to them over there for different reasons then you look at all the doctors in the n h s and their health care system that are saying this is dangerous this cannot continue this is costing people their lives not going to change you think of margaret thatcher at some point you're gonna run out of other people's money
wbap-am-820,76914,1782200604.716745,1782200694.716745,done,26727,4330,"huge representation. It owns, it is what owns the Democratic Party. It drives the Democratic Party to the left. Maybe they won't embrace everything. They're not going to get everything through. I mean, you're not going to change. You're not going to, let's put it this way, you're not going to get rid of the Senate. No, that's not going to happen. And you're not going to government ownership of major corporations in America. That's not going to happen. But that's where the new Democrat leadership in the United States wishes to lead the Democrat Party. And that's part of the, you know, part of the discussion has been over the last couple of days with some of the South American elections and what's going on in Great Britain and other parts of Europe where they're now looking at liberalism and saying this doesn't work. They're rejecting it as the United States seems to be embracing it. And it's like there's no critical thinking or, I'm sorry, a lack of human intelligence, you know, when you've got a place like Maine that may elect a Nazi who got a ton of votes and won in a landslide in the primary. I mean, when you've got that going, it's like, it's like, holy Toledo. And so I just, I look at Great Britain, I just went, well, they're sort of, they seem to remind me a little bit of California. Well, let's do the same thing. You know, it isn't working."
klif-am-570,76915,1782200559.2063274,1782200649.2063274,done,26728,4798,"I don't know what you're trying to pull here, but he goes, you guys need to knock it off. And he said, you called me last night and there were javelinas at the door and I chased them away. And I looked at Michelle. What are javelinas? So we live in Arizona and in Sedona, there's these, there's kind of like a mix between a boar and a pig. There are these kind of like furry pigs that are wild here. They're called javelina in Arizona. And Michelle looked at me and she goes, listen, officer, we didn't call you last night. And we came to realize later that, you know, the night before I prayed, I got on my knees and I prayed to Jesus to protect me because I was scared out of my mind. And later we realized, what did Jesus do? He would turn the demons into pigs, into swine. And so this officer came, said he was there last night. He wasn't. So there was two timelines of reality that were going on. But he was not lying to you though, was he? He wasn't there. That's the thing. This officer swore he was at our house the night before when I had had that dream, but he wasn't. It was just a dream or was it? Or was it? Or was it? I'll never know. I don't think to this day. So I believe that there were two timelines happening."
klif-am-570,76912,1782200476.2057397,1782200566.2057397,done,26725,3376,for your body right Linda you've been doing this I have been doing it and the test is easy it's got great steps it walks you right through it's easy to do you can send it right in take the guesswork out of it get real data go to viome slash Hannity viome.com slash Hannity today and when you follow their plan you can expect better digestion more energy improved mood stop guessing start knowing coast-to-coast continues on 570 K L I F and welcome back George Norie along with Christy Crabtree her website is linked up at coast to coast am calm Christy you've become somewhat of an expert in consciousness tell me about its role so consciousness is like the substrate of reality and so what I've come to find is that the third dimensional reality organizes itself around consciousness not the other way around what is consciousness you know consciousness I I believe it's God it is the substrate of all reality it's what makes up everything on our planet so you know it's our awareness and what we put our awareness on we you know
wbap-am-820,76913,1782200368.2388833,1782200458.2388833,done,26726,4923,likely by andy burnham was a left-wing who's a left-wing politician and so it's like okay what are you gonna do different we're gonna promote different and and the fact is it's like you know the party's trying to figure out you know what are we going to do as they look at the the of public opinion polls the public is maybe moving the other way now maybe maybe there will be movement like we've seen in south some south american countries columbia for example holding their election and you saw what happened you know uh... you know down there and so you know i i was reading uh... what uh... what uh... uh... burnham was saying i'm like okay there's nothing specific here they're not really going to change and you look at it here i mean we we look at the democratic party here in the united states yeah and how insane they've got we've seen we we let you know what's in their platform when we say insane we're not trying to be over the top and throw over the top rhetoric at it it's the issues that they're talking about the democratic socialist of america which is has huge representation it owns it is what owns the democratic party it drives the democratic party to the left maybe they won't embrace everything they're not going to get everything through i mean you're you're not going to change you're not getting let's put it this way you're not going to get rid of the senate that's not going to happen and you're not going to go government ownership of major corporations in america
klif-am-570,76911,1782200341.1776721,1782200431.1776721,done,26724,4520,"for child care? LifeLock has your back. Need coverage for lost wages because work had to take a back seat throughout all of this? You guessed it, LifeLock has your back. Plus there's coverage if you need to pay fees for lawyers and experts to resolve your case. Don't face the burden of identity theft alone. Protect your future and finances with LifeLock. Join today and save up to 30% your first year with promo code GEORGE. Call 1-800-LIFELOCK or go to LifeLock.com and when you're there use promo code GEORGE to save 30% terms apply. And everybody cares about health, wellness, fitness, nutrition and so many of us are guessing our way through our health, guessing what foods to eat, what supplements to take, wondering why some things make us feel better than others. Now that's where Viome comes in. It's a simple at-home gut health test that uses advanced RNA technology. It analyzes your gut microbiome to understand how your body is truly functioning in this moment and from there Viome then creates a personalized food and supplement plan designed specifically for your body. Right Linda? You've been doing this. I have been doing it and the test is easy. It's got great steps. It walks you right through. It's easy to do. You can send it right in. Take the guesswork out of it. Get real data. Go to V-I-O-M-E slash Hannity. V-I-O-M-E dot com slash Hannity today and when you follow their plan you can"
wbap-am-820,76910,1782200285.2382407,1782200375.2382407,done,26723,3941,and it came down to it in i can't remember whether it was uh... uh... bianco or hilton who just said you know you you look at the polls i mean roughly you know the republicans have about you know if you look at the primary results about what thirty percent so democrats support still is seventy percent it could change in the election you never know it could be it could be closer that i forgot was beyond or hilton said these are the same people they're saying they're going to solve the problems they endorse and supported all the initiatives that created the problems that we have no i mean and it just seems like it and and i saw you say someone wrote it's like you know at great britain is like california they know what they don't like which is the result of their policies but they don't know what they like well that's it well because here's the thing if u are to move more toward conservative principles work has to be done and it's hard over there they use a word called austerity don't you dare though in twenty twenty six talk about making cuts
klif-am-570,76908,1782198502.2796474,1782198592.2796474,done,26722,4163,"right back. Last year, one in six Americans lost money to digital fraud, an average of fourteen hundred dollars through scam emails, websites, phone calls, and text messages. And worse still, A.I. is making it easier for these criminals to create sophisticated scams. To help protect against fraud, limit the amount of identifying information you share online and generate strong unique passwords using a password manager. Cyber threats are everywhere, that's why LifeLock monitors hundreds of millions of data points a second for identity threats, which is way more than anyone can do on their own, and LifeLock alerts you right away if anything pops up. If you do become a victim of identity theft, you get your own restoration specialist who will fix identity theft, guaranteed, or your money back. Your protection is backed by LifeLock's million-dollar protection package, and if your money is stolen, or you need coverage for personal expenses or lost wages due to identity theft, LifeLock has your back. Join now, save up to thirty percent off your first year with promo code GEORGE. Call 1-800-LIFE-LOCK or head on over to LifeLock.com and use promo code GEORGE for thirty percent off. Terms apply. Hey there! Garden Gnome here. I've been standing in this yard for years."
wbap-am-820,76906,1782198374.1594908,1782198464.1594908,done,26720,3912,"Start your day with the morning jolt of Drake C. Toll. You've never been a football coach before, so you're not allowed to talk about this. No, I can have burnt mozzarella sticks and say the chef's not working. Bold takes and breaking news. And now to do that with Westwood One, the Oxford University of Names in sports media. So buckle up. It will be like nothing you've heard before in the best way possible, and it represents you, the listener. Westwood One Sports Talk, your home for Drake C. Toll. Follow and listen on your favorite platform. DFW's most trusted news, talk, traffic and weather station. News Talk 820, WBAP. And now on FM at 93.3. Now it's Red Eye Radio. Gary McNamara and Eric Hurley talk about everything from politics to social issues and news of the day. Whether you're up late or you're just starting your day, welcome to the show from the Relief Factor Studios. This is Red Eye Radio all across America. We are Red Eye Radio. He is Eric Hurley and I'm Gary McNamara. Welcome and good morning. Hello. Oh, by the way, was this addressed in the MOU?"
klif-am-570,76907,1782198266.2906864,1782198356.2906864,done,26721,2975,"Even my old man looks good When they just don't go When they go too slow I've got Friday on my mind Gonna have fun in the city Be with my girl, she's so pretty She looks fine tonight She's outside to me Tonight, I'll be my friend tonight I'll lose my head tonight I've got to get tonight One day I'll have Friday on my mind Live from the City of Angels This is Coast to Coast AM with George Norrie Up next, first-time guest Christy Crabtree joins us to talk about surviving trauma and what we can do about it when we come right back Last year, one in six Americans lost money to digital fraud an average of $1,400 through scam emails, websites, phone calls and text messages and worse still, A.I. is making it easier for these criminals to create sophisticated scams to help protect against fraud, limit the amount of identifying information you share online"
wbap-am-820,76905,1782198206.558815,1782198296.558815,done,26719,2842,"Thanks for watching! I'm not a fan of it, but I'm not a fan of it. I'm not a fan of it. I'm not a fan of it. The Hammer Alley podcast, an eighties flashback mockumentary. How did they go from top of the rock to rock bottom?"
klif-am-570,76904,1782198183.2902122,1782198273.2902122,done,26718,4627,"Joining us from Tel Aviv, Israel to Washington, to your own backyard. If a story impacts you or your wallet, we're on it. It's the Fox News Rundown. We give every story the deeper look it deserves with must-listen interviews and smart analysis from the voices you can trust. Start your day with the Fox News Rundown. Listen and follow now at Fox News Rundown.com or wherever you get your favorite podcasts. From the Fox News Podcast Network. Hey, this is Trey Gowdy, host of the Trey Gowdy Podcast. Every Tuesday, you'll hear what's on my mind. Plus, every Thursday, there's a special bonus episode where we answer the questions that are on your mind. Make sure to spend your Tuesdays and Thursdays with Trey. Subscribe now at FoxNewsPodcast.com or wherever you download podcasts. Hope to see you. America is listening to Fox News. It's primary day in Maryland, Utah, New York, and primary runoff dance. South Carolina, Fox is Jessica Rosenthal with more. Earlier this month, Lieutenant Governor Pamela Yvette came out ahead with nearly 29% of the vote, a few points ahead of Attorney General Alan Wilson. Now the two will face each other in a runoff. While President Trump endorsed Yvette before the primary, he's now endorsing both Yvette and Wilson in the runoff, writing in a recent truth social post, he can't hurt one of them by only endorsing the other. There are congressional race runoffs as well, including in Nancy Mace's first district. Charleston County Councilwoman Jenny Costa Honeycutt is up against the state representative."
wbap-am-820,76903,1782198123.5584385,1782198213.5584385,done,26717,3876,"Fox's Jonathan Savage has more from London. Keir Starmer will remain in number 10 Downing Street until his Labour Party chooses a new leader. Nominations open on July 9th and close one week after that. If there's more than one name in the ring, Labour members will vote over the summer. If there's only one candidate, that man or woman will automatically get the job. The favourite is Andy Burnham, sworn into Parliament just hours after Starmer's resignation speech, having won a special election last Thursday. This was his plan all along, leaving his job as Mayor of Manchester in order to force his way into Downing Street. In London, Jonathan Savage, Fox News. And more than 11,000 bottles of 25 milligram chlorothalidone tablets are being voluntarily recalled because testing found they failed to dissolve at the proper dosage level they were manufactured in India. America's listening to Fox News. TFW News Talk, traffic and weather station. Your Texas voice for common sense. News Talk 820 WBAP. And now new on FM at 93.3, trending now. Defining a newcomer. I'm Mark Mayfield from the 24-hour Breaking News Center. In the race for Senate, Texas Republicans have started pounding on past statements made by Democrat James Tallarico. Experts say there is a rush to define who the political newcomer really is. His track record shows that he is."
klif-am-570,76902,1782198013.7636783,1782198103.7636783,done,26716,4168,"remains optimistic the race is on to replace British Prime Minister Keir Starmer who announced his resignation over the weekend. Fox's Jonathan Savage has more from London. Keir Starmer will remain in number 10 Downing Street until his Labour Party chooses a new leader. Nominations open on July 9th and close one week after that. If there's more than one name in the ring, Labour members will vote over the summer. If there's only one candidate, that man or woman will automatically get the job. The favourite is Andy Burnham, sworn into Parliament just hours after Starmer's resignation speech, having won a special election last Thursday. This was his plan all along, leaving his job as mayor of Manchester in order to force his way into Downing Street. In London, Jonathan Savage, Fox News. And more than 11,000 bottles of 25 milligram chlorothalidone tablets are being voluntarily recalled because testing found they failed to dissolve at the proper dosage level they were manufactured in India. America's listening to Fox News. From around the world, Trey Yengst joining us from Tel Aviv, Israel to Washington, on my manual to your own backyard. If a story impacts you or your wallet, we're on it. It's the Fox News rundown. We give every story the deeper look it deserves with must-listen interviews and smart analysis from the voices you can trust. Start your day with the Fox News rundown. Listen and follow now at foxnewsrundown.com or wherever you get your..."
wbap-am-820,76901,1782197952.8742905,1782198042.8742905,done,26715,4312,"HD to Fort Worth, Dallas. Talks continue. I'm Ted Lindner, Fox News. President Trump says the US has total control of the Strait of Hormuz's talks between the US and Iran wrapped up in Switzerland. Fox is Lucas Tomlinson with more. President Trump says Americans will benefit from a relaxation of sanctions if Iran complies with the memorandum of understanding. Money that's being unfrozen is going to be used to buy food and the food's going to be bought exclusively through the United States from our farmers. Vice President J.D. Vance expressing optimism after negotiating with an Iranian delegation for 18 hours in Switzerland. The Iranians have agreed to invite IAEA inspectors back into their country. That is a major milestone for the American people. Iranian state media controlled by its Islamic Revolutionary Guard is disputing Vance's assertion, calling it false. Some critics are skeptical Iran's nuclear capabilities have actually been stripped away, but the White House remains optimistic. The race is on to replace British Prime Minister Keir Starmer, who announced his resignation over the weekend. Fox's Jonathan Savage has more from London. Keir Starmer will remain in number 10 Downing Street until his Labour Party chooses a new leader. Nominations open on July 9th and close one week after that. If there's more than one name in the ring, Labour members will vote over the summer. If there's only one candidate, that man or woman will automatically get the job. The favourite is Andy Burnham, sworn in..."
klif-am-570,76900,1782197930.7632444,1782198020.7632444,done,26714,2853,🎵Music🎵 🎶Music🎶 The United States Soccer Federation presents the US Soccer Podcast. My name is David Goss and I'm joined by my co-host Megan Klinenberg. Everything up until this point has been an outside look at the World Cup. And I'm here right now.
wbap-am-820,76899,1782197869.8737843,1782197959.8737843,done,26713,2063,Thanks for watching! 🎵
klif-am-570,76898,1782197829.1329277,1782197919.1329277,done,26712,3036,Music 🎵 I don't need to hear anything from anybody. There's too much riding on my mind being locked in play offense not defense.
wbap-am-820,76897,1782197633.2505116,1782197723.2505116,done,26711,3907,"It's like, it's been like this for a while, we claim victory, and Iran says no, we didn't agree to that. And it's like, yeah, thanks to the listeners who sent us the Victor Davis Hanson comments that he made, none of what he says addresses the criticism we have of it. Somebody was sending that to us as if it addresses our criticisms. It does not. No. No. But we do appreciate it. This is Red Eye Radio, on Westwood One. Nightly Scroll with Hailey Caronian. I'm Hailey Caronian. Love this country, love all of you homies. Your go-to place for the hottest button issues. I have a message, and they're not going to like my take. Not illegal, by the way. Cut through the noise and get ready to scroll through the chaos of the modern world. This feels refreshingly apolitical, but also awesome."
klif-am-570,76895,1782197609.7566888,1782197699.7566888,done,26710,4898,"The people that make them happy, I don't know. You know, it's energy that makes us run. That's our gas. And the energy comes from the sun. And in the Christian world, if you look at it metaphysically, you are the son of the sun or the daughter of the sun and all the energy of the sun comes from beyond the sun and it's consciousness and it burns and it spits out. And if you ever look at the sun, you'll see it form a pyramid. And that's how things come down to earth, like a pyramid. They come as a laser and then they spread out. And I love learning all this stuff. I love sharing all this stuff. And I don't know, I believe what I believe in is a happier ending. What's your next project, Steven? Right now I'm just finishing up my record label. I've got a lot of records coming out. I've got an Italian record. I've got a lot coming out, maybe a book, you know, another book, but I don't know what to write. I'm just, right now I'm just doing it, you know? I just have so much to share with people and I'm doing it through music. And my goal is to make sure that cultures stay alive, which is why I have SSK. And you know, I want culture to stay alive. I wanna go around the world producing music, producing plays, encouraging people to create. I have a couple of new English rock bands coming out. I've got a woman named PIPPA, who will..."
