station,chunk_id,start_ts,end_ts,status,transcript_id,asr_duration_ms,transcript
klif-am-570,76091,1782154332.0300333,1782154422.0300333,done,26108,13562,"Hey, I'm Chris fan fleet go behind the scenes and beyond the headlines with people like John Cena That's where never give up comes from and the biggest names in pro wrestling and beyond Insight with Chris family follow and listen on your favorite platform If 70 kl if and ninety six three FM HD to You're listening to the VIN show find out more 24-7 at the VIN show.com Want to thank quince for supporting the program and my wardrobe love quince summer always brings changes to how I get dressed I'm sure it does for you too because you start reaching for those pieces that feel lighter breathable easy but still put together and this is why I keep coming back to quince the quince in fact I was wearing a quince shirt yesterday and I facetimed with my dad Jim for Father's Day and he goes that's a good shirt where's that from"
wbap-am-820,76084,1782154264.054893,1782154354.054893,done,26106,20842,"It was a glancing shot, Nimrod to the news, to the news update next, Michael Jordan, Mark Lee, Van Camp, and Robbins, News Talk 820, WBAP, and now on FM at 93.3. A small business affirmation from Progressive. Plumbers, today will be a good day. You will be profitable. Your clients will be nice. No one will stand over you and tell you how to fix the thing they actually hired you to fix. You will also feel at peace after switching to Progressive, America's number one commercial auto insurer. See if you can save in as little as eight minutes at progressivecommercial.com. Progressive Country Insurance Company and Affiliates, number one commercial auto insurer from the NAIC's 2024 National premium data. Lenny went to college and racked up huge debt. A little bit over $100,000. For a degree he couldn't use? Now what? I had a friend that went to my computer career. They even helped him get hired immediately after graduation. One of the things I love about IT is that you can work from anywhere you want. You could become an IT pro in just months, including cybersecurity and the basics of AI with zero experience at mycomputercareer.edu. My Computer Career, an elite CompTIA certification partner. It works for me and I know it can work for you. This is one student's experience. Individual results vary. Are you an adult with uncontrolled moderate to severe Crohn's disease symptoms and still packing a backup bag of clothes? Just in case, Skyrizzy Risenkismabrizza can help you take control of your Crohn's. Feel significant symptom relief, including less abdominal pain and fewer bowel movements at four weeks. Plus, Skyrizzy has proven to help people achieve remission and visibly improve their lives."
wbap-am-820,76076,1782154181.0543592,1782154271.0543592,done,26100,27642,"I was just a goofy high school love letter, but it got $32,000, because there's never been one to come to auction before. So this is a rarity, my friends. So when you have that, what do you do with it? Oh, I frame it. I'm at it and frame it. And then people come over and what do you say? I say, hey, look at this. I got the Michael Jordan love letter he wrote to his childhoods or his high school sweetheart. Okay. Ever seen that before? No. No, so there you go. Did you tell them about the time that you saw Michael Jordan naked? I could. I could pivot to that, yes. Yes, because that is true. And it was after a basketball game, David. Don't make it sound weird. Okay. It's not like we were doing a movie. It was a charity basketball game. Charity basketball game. We shot it after the game. It was steamy. You know, I've said it before and I'll say it a million times, Michael Jordan was a gifted man in many, many ways. And I usually leave it at that. That's my parting shot when I do my speaking engagements. Should I leave it out of the act? Is that what you're telling me with your silence? You've heard it before. I've heard it for years. Yeah. Yes. What's weird is you with your eyes like saucers looking at his genitalia going, what guy does that? Not true. Quick glance. There you have it. Quick glance. Weird story when you loofed his back. I thought that was odd. Okay, see, that never happened. That never happened. He didn't even ask for it. Can you touch the middle of your back? Mike, I'm here to help. Something like that. See, that's something that you're taking in 30 minutes. Why do you look at another guy's junk? Why do you do that? Dude, it was a glancing shot. That's all. Nimrod to the news. To the news update, Max. Michael Jordan. Mark Lee Van Camp & Ride."
klif-am-570,76074,1782154166.0290377,1782154256.0290377,done,26098,14344,"months including cyber security and the basics of AI with zero experience at my computer career dot edu my computer career and elite CompTIA certification partner work for me and I know it can work for you this is one student's experience individual results very Vince colonies on our app or on your smart speaker we're there 24 7 570 kli F and 96 3 FM HD 2 you action. Next Roll is a groundbreaking podcast created and executive produced by Vernon Davis providing cinematic storytelling with thought provoking conversations. The series explores the transformative journeys of athletes, artists, comedians and entrepreneurs as they redefine their careers and push their creative back."
klif-am-570,76067,1782154083.0285158,1782154173.0285158,done,26094,21523,"in Maricopa County. There was an FBI raid there in Arizona. Remember that? Remember the FBI raid in Fulton County, Georgia, where they picked up all those ballots, brought them in, all the election stuff from 2020? What's going on there? In fact, what's going on in South Florida right now? We have a grand conspiracy case apparently underway, US Attorney down there, demanding all sorts of answers from people around John Brennan and James Comey and others. What's going on there? Just have this feeling like we're gonna have a lot of really interesting headlines to discuss. And it may come sooner rather than later. God willing. More ahead on The Vince Show. The Vince Show. So Ryan and I came to the decision to get life insurance when I was pregnant with our first son. He really wanted us to be taken care of if something happened to him. He provided for our family in life and also after his death. I think that would make him proud. Ethos makes it fast and easy to get life insurance. Apply in minutes and get same day coverage. Get your free quote at ethos.com slash save. That's ethos.com slash save. Paid testimonial. Time spent on application may vary. Online health questions required. Lenny went to college and racked up huge debt. A little bit over $100,000. For a degree he couldn't use? Now what? I had a friend that went to my computer career. They even helped him get hired immediately after graduation. One of the things I love about IT is that you can work from anywhere you want. You could become an IT pro in just months, including cyber security and the basics of AI with zero experience at mycomputercareer.edu."
wbap-am-820,76061,1782154015.0532448,1782154105.0532448,done,26091,19453,"There's been crowds that have been for me in my career, there's been crowds that have been significantly against me in my career You know, I think of Portrush was a scenario for me where you know, Rory's in his hometown or not his hometown he's in Ireland and Not far from where he grew up and you know, the crowds can be tough and being in the... Yeah, that is true They can be tough. It's funny. There are different accounts on X and there's one Account that's Shooter McGavin from Happy Gilmore And the Shooter Gavin account said a lot of poor Wyndham-Clark talk today with the New York fans Please did he ever have a beach fly onto the green mid putt? No, did he ever have two bikers in the woods off 17 having sex mid-chip? No, did he ever have a nine iron destroyed on the tee box? No, no, he's no shooter Just to wrap that whole thing up. Yeah, the next guy who says get in the hole should be electrically shocked I've said it for years. No one likes to get in the hole guy. That guy makes me crazy Yeah, it's never been done before jackass. It's not clever. No, it's just dumb Now on with the case you guys got Robert strike effect up to number two number two Alyssa Milano is a nut and you love talking about her Happy Juneteenth Alyssa Milano tweeted out and she's had a big print reparations are realistic and necessary No, okay do it now People pointed out after she said that that this is the same person"
wbap-am-820,76052,1782153932.052813,1782154022.052813,done,26087,25053,on get in the sand what didn't didn't he wrecked the when of course you know about last year yeah yes he's lost his cool a number of times he's not the most likable guy apparently not i didn't know a lot about him but man i could tell from crowd they didn't like him yeah they were not rooting for me all now there was a cool moment when he won his dad was there in yeah father's day in a big again well he owned it i mean he did say yeah unfortunately up and i'm an idiot yeah of what is he saying something like some of its deserved like the crowd being against me so it's real ugly wife in market that was a girlfriend okay kidding about this is a real ugly now they're not the house is golfers dot will always say what is it with the golfers in the women all my guys what a smoke show it's crazy will think that money and i live in race car drivers and golfers guaranteed you know what i didn't even heard this yet i think shuffler talked about the crowd being as when clark denny yeah i don't know that you're doing it now we're doing it i mean the crowd was was tough today i mean you're strict tough tough people uh... there's a good turnout from the fans you know they uh... uh... you like seeing the fans here for you i think uh... sometimes it can get a little too much when balls are kinda go off greasy start hearing cheers that that uh... felt a bit much to me uh... but then i can control fan behavior it's uh... being in the arena is is not for everybody you know there's there's been crowds of informing my career there's been crowds of insignificant see my career you know i think of of port rush was a scenario
wbap-am-820,76049,1782153849.052312,1782153939.052312,done,26086,24907,"I'm surprised they didn't advertise it to that crowd as a mulligan pill. Well, you know, you know, David, very clever on your part right there. Day before Father's Day, too. Nice. Yeah, especially when there were so many golfers and spectators with strong faith. Felt like an intentional distraction by outside agitators. Well, it was! Wow, I hadn't even heard about that. Yeah, well, they obviously didn't show it on TV. Yeah. But, uh, wow. And I think maybe that's what they were hoping for. Maybe. That they might get a plug on TV while it was up there, but that didn't happen, so. It was odd in that, boy, I don't know if you've ever seen an American-born player where the crowd was against them so much they were rooting for bad shots. Oh, gosh, yeah. I mean, you knew the crowd would be with a Scottie Scheffler going for the career grand slam, all that. But, dude, when Bill Young, get in the sand! Well, didn't he wreck the clubhouse? Oh, at Oakmont last year. Yeah. Yeah, he's lost his cool a number of times. He's not the most likable guy. Apparently not. I didn't know a lot about him, but, man, I could tell from the crowd they didn't like him. Yeah, they were not rooting for him at all. Now, there was a cool moment when he won that his dad was there and Father's Day and he gave him a big hug and... Well, and he owned it. I mean, he did say, yeah, unfortunately. Yeah, he screwed it up and I'm an idiot, yeah. What does he say? Something like, some of it's deserved. Like the crowd being against me. I saw his real ugly wife give him a hug and... That was a girlfriend. Okay, kidding. I bet they are. Did you say real ugly? No, they're not. They're just golfers."
wbap-am-820,76042,1782153766.0516524,1782153856.0516524,done,26082,18836,you know there's this thing i call absolute focus like i like activated that like in my mind yeah when folks activated his mind there's a button that you press yeah that's very funny well sometimes you're trying to save somebody and then when they're panicking yeah they can take you down oh yeah you know flailing around and everything else man spooky situation dude absolute focus maximum absolute focus yeah yes that's what it takes all right are you ready for your big three scottie sure all right here we go are you ready it's the three most important news stories of the day i hit the trifecta well at least according to scott robbins it's the trifecta on the markley van camp and robbins show every day about this time scott robbins top three stories helped by his hero and casey casey hey casey you want to see us open this weekend yeah did you i know you're a big golf fan so yeah i'm ready you like windham do you no no i didn't think very few people do boy man the fans gave it to him huh yeah they did three gave him the business uh number three an ad at the u.s open is appalling some fans yeah golf fans that were attending the third round of the u.s open uh this past saturday left stunned when an airplane buzzed the course uh towing a big advertisement for promoting obtaining abortion pills by mail whoa the ad was paid for by mayday health a massachusetts-based
klif-am-570,76041,1782153751.0260568,1782153841.0260568,done,26081,17559,"And they generated this list. They just caught number two. Number two has been captured. His name is Herbert Leon Kimball. He's 60 years old. And he was found in the Philippines and arrested. He's been evading authorities for nearly two years. He ran a $1.2 billion Medicare fraud conspiracy, according to the feds. Here's the reporting as it was breaking today. This is over on over on the Fox News Channel, Bill. Bill Mollusion. You'll hear his voice here. Second most wanted fraudster. He's allegedly behind. Listen to this. A $1.2 billion Medicare conspiracy. Billion with a B. White House officials praising the anti-fraud task force's role in making this bust. This is why this task force was so important, because it has focused all of the resources of the federal government on doing this. The Biden administration could have gotten him. They found plenty of time to arrest people playing outside of abortion clinics. Instead, they let this guy run away with all of his money outside of the country. And David Spun is joining us live from Washington with the latest on this. David, DOJ has been busy, busy, busy making these busts. The department really has, Bill. This capture is part of that administration's approach to highlight fraud. Sure, other justice departments in the past have caught fraudsters and did it for decades. But this time, the FBI and DOJ put together a most wanted fraudster list with eight people."
wbap-am-820,76034,1782153683.0511959,1782153773.0511959,done,26078,19239,wires and stock inside traders like row the robber should be in prison study on the standard applied by those was very simple and easy provide contact information for the recipients of aid so that we can confirm it's not fraudulent i think it is kind of interesting to the point of u s a i d mhm is now that a lot of that money is not going to organizations non-governmental organizations in south america all the sudden there's like a lot of right winger conservative people winning presidencies columbia's latest example very interesting and i'm you know i have you know correlation is not causation but it is quite interesting yeah no kidding uh... another story out there this is a nice story i thought you know the heroes really should be applauded more often when they do something like this this dude jordan matthew louisiana rescued three people caught in the uh... recurrent there they'd young boy first then got a one woman sure before swimming back at the rescue another woman who was just exhausted carry one of my shoulder bring your safety well talked about it afterwards i'm coming back and on the mall this argument but you know the way that that's over there and i get rid of the rough life i think you might get that i'm pretty far with the current i know they're like you know that i would like to run out of energy so i'm just like stay calm you know there's this thing i call absolute focus like and i i like activated that like in my mind
wbap-am-820,76019,1782153517.050156,1782153607.050156,done,26069,17679,"they don't give up on this class of good morning everyone and thank you so much mayor is officially summer in new york city for millions of working new yorkers heat isn't just uncomfortable it's hazardous extreme heat kills more americans every year then hurricanes floods and tornadoes combined and we know because of climate change is only getting worse how do we know that she knows that i've seen a lot of facts and figures that would say that's actually not accurate right more flies in the barn the number of days above ninety degrees is projected to increase significantly in the years ahead and despite all of this extreme heat is still not recognized under federal law as a workplace hazard well do you want to keep going? that'll fix it right? yeah if you just name it that no enforceable national standard no guaranteed protections workers on the clock in the heat with no clear legal right to shade, rest or water even though we know that those basic steps save lives dude what are we talking about here? i don't know i'll tell you man somebody in the construction industry who doesn't take care of the workers in that way is not going to be in the construction business very long deny yourself a drink of water? yes you cannot have a drink of water"
klif-am-570,76017,1782153502.0247352,1782153592.0247352,done,26068,20713,"We asked the Qataris to help us set up the mechanism so that we can ensure that the money goes where we want it to go. This is to American farmers, right? This arrangement. We're going to sell American agricultural products by we're going to take that those frozen Iranian access assets, use them to purchase soy, corn, wheat from American farmers. Send that food product to the Iranian people. You want that money back? Good. It's going to be a form of American food products, agricultural food products that will enrich American farmers and feed the people of Iran. And they agreed to do that. We have a good relationship, obviously, with them and a good operational oversight mechanism in place. But even with that said, even with the caveat that's going to benefit American farmers and obviously benefit the people of Iran, we want both. But fundamentally, that money is not going to be unfrozen unless we continue to see progress. That'll obviously be a big part of the negotiation in the days to come. Yeah. All right. So American farmers have a rooting interest here and Iran doing the right thing in this process because they could see a big windfall from a lot of a lot of frozen Iranian assets paid to American farmers. Fun. Love that. Also this weekend, Jen, did you see these videos going around of that? The Iranian delegation stood up, J.D. Vance. You see, they left the room and J.D. Vance was insulted and then he had to just take it. That was fake news. And J.D. Vance."
wbap-am-820,76012,1782153434.049478,1782153524.049478,done,26064,14888,"I'm CJ Pearson and I'm the host of The CJ Pearson Show. Every week, we'll take on the biggest cultural, political, and moral battles in America head on. No spin, no filters, and no apologies. This is The CJ Pearson Show. The CJ Pearson Show. Follow and listen on your favorite platform. The James Show next at two on Newstalk 820 and 93.3 FM WBAP. The monthly Van Camp and Robin Show. Thank you so much for being here. I'm Jamie Markley, the Gen X-er. David Van Camp's the millennial and the sexy boomer. That's Scott Robbins, who has his trifecta coming up, his top three stories. The New York City deputy mayor is talking about extreme heat killing more Americans every year than hurricanes, floods, and tornadoes. Okay. And it's not recognized. Boy, they don't give up on this climate, so do they. Good morning, everyone, and thank you so much, mayor. It is officially summer..."
klif-am-570,76001,1782153336.0237465,1782153426.0237465,done,26059,17375,96.3 FM HD two be heard call 844-484-3872 844 for the USA and tell us what you think the Vince show well uh cheerful vice president J.D. Vance just boarded air force two and route back to the United States of America from Switzerland before he did that he he talked to the press which is nice uh a transparent administration and gave everybody an update on how things went with iran and said that he's leaving a team behind they've got negotiators who are going to stick around and continue to do this work and the iranians have also left a delegation there we're going to continue to hammer out details over the course of what appears to be these next 60 days en route to a final deal here's J.D. Vance uh saying some of the positive developments that have transpired over the last 24 hours prices and gas prices are going to keep coming down number two we actually set up the right mechanism to ensure the regional ceasefire to manage the inevitable conflicts that will come up we feel great about that we're working with our allies from the israelis to the gulf arabs to make sure that sticks and we feel very very good about where that is we have the iranians allowing weapons inspectors nuclear inspectors into the country for the first time in a long time we're obviously going to bolster those inspections that inspection regime to make sure they can never have a nuclear weapon and and finally
klif-am-570,75986,1782153170.0227387,1782153260.0227387,done,26051,16218,"And British Prime Minister Keir Starmer announcing his resignation, forced out by his party after losing voter support. He'll remain as caretaker until they choose a new leader. America is listening to Fox News. We've got a couple of problems in Fort Worth. As you head into downtown, 287 MLK is shut down between Mitchell and Rosedale due to a wreck with a backup from Barrie. That's about a 17-minute delay. Also, 20 eastbound just past the east loop. We've got two right lanes blocked, and that was backing up traffic from Wichita. And in Dallas, Loop 12, Walton Walker northbound past 114, two right lanes are blocked. That has traffic backed up from 183. That's a 20-minute delay. With KLIF right now traffic, I'm John Wolf. Start your day with the morning jolt of Drake Setole. You've never been a football coach before, so you're not allowed to talk about this. No, I can have burnt mozzarella sticks and say the chef's not working. Bold takes and breaking news. And now to do that with Westwood One, the Oxford University of..."
wbap-am-820,75980,1782153102.0469418,1782153192.0469418,done,26048,19193,vacation tune into striking gold with kitty michaels every sunday at ten a m and learn more about precious metals that's striking gold from gold crest metals gold crest metals dot com t f w's news talk traffic and weather station your texas voice for common sense news talking twenty w b a p and now new on f m at ninety three three trending now the dallas maverick's coaching vacancy has been filled i'm mike train up from the twenty four hour breaking news center classic w b a p's first traffic and weather on the ones accident in urbain northbound loop twelve walton walker boulevard just after highway one fourteen this is in the right lane just left lane is getting by it's about a five to seven minute back up to highway one eighty three heading westbound on one eighty three from i thirty five e over to the bush turnpike that'll take you about seven to eight minutes and it's about another ten minutes over to east loop a twenty the accident investigation in ford worth northbound highway two eighty seven mitchell boulevard has been completed all lanes are open again still finding a little bit of a slowdown in forest hill on eastbound i twenty from forest hill drive over to east loop a twenty this is due to an earlier crash with w b a p first traffic and weather on the ones i'm dave classic chevrolet in grapevine number one chevy dealership in the world three years straight
wbap-am-820,75973,1782153019.0461254,1782153109.0461254,done,26044,17555,he's oh my gosh i think that they don't make they don't know the anatomy of ladyboys this is terrible so it's uh... fifty days in uh... jail for both of them label and that we does track music there uh... the couple by the way their last names than arty they started homeschooling their daughters in twenty twenty after observing shortcomings in the public education system during pandemic era remote learning well yeah course and who can blame them for that i can't this is the market and can't run a show most home sellers get one offer and it's never enough orchard changes that money could cure with orchard offers you don't get one offer you get multiple cash offers from serious investors all competing for your home here's how it works but orchard agent submits your home to their exclusive network of local cash buyers they compete to buy your home and you choose the winner no repairs no showings no settling get started with a free home valuation at orchard dot com that's orchard dot com at reliant air conditioning we provide comfort to homeowners who are tired of being taken advantage of schedule online at reliant air conditioning dot com curious about precious metals as a financial diversification tune into striking gold with kitty michaels every sunday at ten a m and learn more about precious metals
