station,chunk_id,start_ts,end_ts,status,transcript_id,asr_duration_ms,transcript
wbap-am-820,76728,1782173802.2563648,1782173892.2563648,done,26556,4553,after the vice president kind of gave his update of where we are now the the president of the United States of America was also asked about you know the the oil sales and and can he was asked a question from a reporter the reporter question I'm gonna say it for you and then play it so that it's harder to hear the reporter to Trump said can you ensure that the Iranians won't use profit from oil sales to rebuild their military listen well they're not supposed to be doing that so we'll see but they're supposed to use money to buy food for their people because right now that people are very hungry and they're buying it exclusively from us corn soybeans and there should be a lot of money I hope it's a lot of money now what's interesting about what the president there and that brings us back to another story is that we now are being told from the vice president JT Vance and the president that the president is going to be the president that the frozen Iranian funds would not be released unless the United States continues to see progress while describing if a guitarist is an oversight mechanism for funds that could be used to buy American soybeans Vance's remarks came after reporter asked whether Iran had already agreed that frozen funds could be used to buy American soybeans Vance replied yeah that was something that came up yesterday we actually asked the Qataris to help us set up the mechanism so that we could ensure that the money goes where we want it to go and they agreed to that we have a good relationship obviously with them and a good operational oversight mechanism in place but even
wbap-am-820,76727,1782173719.2559552,1782173809.2559552,done,26555,5598,setting up a mechanism to achieve elastic ceasefire and the fact that the iranian say that they will allow inspectors to come in terms of the nuclear program but uh... the vice president there with the caveat that says we don't know exactly what that means in history is any guide might not mean much adding that it's been a very confusing process to negotiate with the iranians but that positive talk about getting that oil moving is what continues to send oil prices lower now near seventy four dollars a barrel uh... the u.s. stock market still hovering near all-time high so as long as the messaging continues to be that uh... you know we have reason to believe that the white house is happy with the what they've seen so far done and in the word for the administration and you and i know it's because we're on a call the senior administration official more than a week ago is that if this all transpires in the way that the white house hopes it will it has the potential to transform the middle east vice president reiterated that again but he also said we haven't built the house yet and i would think of all of the things all of the houses are all the buildings that president trump is built over his long story career as a real estate developer building this particular house with the iranians is probably the toughest challenges that and i'm sure that's all part of the vision all right we're gonna have much more on that reaction to it coming up meanwhile the judge in the past so that you can hear there is a lot of you they're scratching their head like the vice president ever the cabinet this is we don't know exactly what that means referring to this you know nuclear inspections and if history is any guide that might not be much those are the words from fox news channel i think it's very interesting how blunt they were there after the vice president kinda gave his update of where we are now that the president of the united states of america uh... was also asked
wbap-am-820,76726,1782173636.2554984,1782173726.2554984,done,26554,5099,"currently headed for port in South Korea. They listed also intelligence, Lloyd's List intelligence said on Sunday that commercial traffic continued to move through the strait over the weekend despite repeated Iranian claims that it had closed the waterway in response to what described as Israel's violation of a ceasefire because of them targeting terrorists in Lebanon. Now another maritime intelligence company known as Windward concurred with its own analysis that traffic through the southern corridor was not reflecting any closure. They noted that the strait was nowhere near returning to its pre-war traffic loads based on the traffic data. Windward split the analytical difference by observing that high visibility traffic with transponders switched on had stalled even before the IRGC declared the strait was closed on Saturday. So they're turning off their transponders for safety reasons. They said 12 transits today down from 21 on June 20th, neutral and European tonnage absent five of the seven inbound vessels dark, Windward said. So again, that means that they're turning off their transponders because they feel like that gives them a better chance of safely passing through the strait. They said the current traffic profile is dark, sanctioned and Iran linked resemble the late blockade baseline more than a functioning open strait, the analyst concluded there. So this is what the vice president is having to deal with right now. This is what the president's having to deal with right now. This is what the Trump administration's having to deal with right now. And honestly, this is what the world's having to deal with. Now Fox News anchors also poured a lot of blunt. I think a fair way of saying it is cold."
wbap-am-820,76724,1782173470.2546213,1782173560.2546213,done,26553,4629,"Now, CENTCOM referred to the latest bulletin from the Joint Maritime Information Center, which lowered its risk advisory level for the Strait of Hormuz to moderate, and said the strait is, quote, now open. JMIC posted an update on Sunday that said traffic flows are increasing, so not decreasing, even though Iran said that the strait was closed, well, the number of ships going through increased. They said navigational system interference and wider regional military activity continues to warrant caution. Organizational interference includes hailing and surveillance activity by Iran's Islamic Revolutionary Guard, the IRGC. Reuters also reported on Monday that oil and liquid natural gas tankers are indeed moving through the Strait of Hormuz and traffic is picking up. They said four LNG tankers controlled by Qatar headed into the Gulf and through the strait on Monday, while two supertankers, which can carry up to four million barrels of crude alone, cross into the Gulf with one signaling its destination as the Iraqi port of Basra. The report said that the data from the ship tracker also confirmed that. They said two smaller crude tankers carrying just under two million barrels of oil in total sailed out of the Strait of Hormuz into the Gulf of Oman on Monday, citing a different set of ship tracking data for that. So what we now know, it's pretty clear now that this is apparently what Iran says and their propaganda doesn't actually match reality, I think it's fair to say yet again. Now, Reuters also noted that more ships could be passed."
wbap-am-820,76723,1782173368.6403394,1782173458.6403394,done,26552,4741,"gas tankers as well. That is good news for the world economy. The strait was reopened on Thursday after President Donald Trump and the Iranian president signed their Memorandum of Understanding, the MOUs, to establish the framework for a quote unquote peace deal. Just a few days later on Saturday, Tehran announced the strait was closed again because Israel was still fighting Iran's terrorist proxy Hezbollah in Lebanon. U.S. Central Command, CENTCOM, responded by saying that Iran does not control the Strait of Hormuz, quote unquote, very simple. The CENTCOM came out with another statement saying traffic continues to flow and U.S. forces are monitoring the situation to ensure this, in fact, remains the case, is what the CENTCOM spokesman Captain Tim Hawkins said in a statement. Now safe passage through the international waterway remains intact today as 55 merchant ships transited, moving large amounts of cargo and more than 17 million barrels of oil to the global market, CENTCOM said on Saturday. U.S. forces remain present and vigilant to ensure all aspects of the agreement with Iran are adhered to, obeyed and in full force and effect, the statement continued. Now CENTCOM referred to the latest bulletin from the Joint Maritime Information Center, which lowered its risk advisory level for the Strait of Hormuz to moderate and said the strait is, quote, now open. JMIC posted an update on Sunday that said traffic flows are increasing, so not decreasing, even though Iran said that the strait was closed, well, the number of ships going through increased. They said naviga-"
wbap-am-820,76722,1782173285.6397781,1782173375.6397781,done,26551,3376,"Action. Next Roll is a groundbreaking podcast created and executive produced by Vernon Davis. Providing cinematic storytelling with thought-provoking conversations. The series explores the transformative journeys of athletes, artists, comedians, and entrepreneurs as they redefine their careers and push their creative boundaries. Next Roll isn't about what's next. It's about fear they had to fight through, the resilience, and what they have to do to achieve everything at the highest level possible. Next Roll with Vernon Davis. Follow and listen on your favorite platform. Ben Ferguson filling in for the great one who is in Israel and he will be back with you soon. I'm holding down the board for a couple of days for Marc and it's really it's always an honor to be filling in for the great one. How do you get in touch? It's easy. You can call us 877-381-3811. You can also send me your thoughts on X. I read all the comments during the break, I promise you. So you can send me your comments there at Ben Ferguson Show and if you're on Instagram you can follow me right now on Instagram at Ben Ferguson Podcast."
wbap-am-820,76721,1782173184.4222414,1782173274.4222414,done,26550,3406,"The Bob and Tom Show. Women make things up in their heads. Yeah, is that what you're thinking? Have you ever met you? All day, whenever you want. I will complain about the roundabout. A lot of women will pull up and stop. There's nothing coming. I don't know if it's women. I feel like it's more age. Right, you never know. These cars are fast. What are these cars? They fly out of nowhere. Good Lord. People coming at you, all angles? My cousin Dorothy, she got hit. The Bob and Tom Show. Follow and listen on your favorite platform. www.thebobandtow.com www.thebobandtow.com www.thebobandtow.com Make a splash this summer with the Summer Vacay Payday. Five winners will each score $1,000 to soak up a weekend getaway or a stellar staycation. Head to our website to enter this national contest for your chance to give your summer a serious glow up. With $1,000 in the Summer Vacay."
wbap-am-820,76720,1782173101.4217849,1782173191.4217849,done,26549,2081,The 60 day countdown is on what will the US and Iran finally work out the latest development starting at five and it's officially summer we Texans will find out because we could soon see 100 degrees around here Brad is tracking it all on the ones all morning long I'm Ernie brown and Carla Marion body cook as you news headlines at the top and bottom of each hour Julie to Hardy has your traffic and chief meteorologist Brad Barton has your weather on the ones plus how Jay has the laughs tomorrow morning five till nine on WBAP's morning news on your Texas voice for common sense news talk a 20 and 93 3 FM WBAP the United States Soccer Federation presents the US soccer podcast my name is David Goss and I'm joined by my co-host Maggie
wbap-am-820,76719,1782172932.7685018,1782173022.7685018,done,26548,3956,"Brought to you by networthradio.com, stocks and mixed amid falling big tech stocks. The major averages kicking off the new trading week mixed as investors monitor the latest developments between the US and Iran, however struggling big tech weighed on the Nasdaq. Consumer discretionary and communications services were the worst performing sectors while healthcare and industrials advanced. And shares of Elon Musk's rocket company SpaceX falling for a third straight session and suffering its biggest one day decline since going public earlier this month with its stock falling over 16%. The Dow winners Caterpillar, JPMorgan Chase and United Health Group. The Dow decliners Amazon, Microsoft and Home Depot. The Dow up 148 points, the Nasdaq lower by 351, S&P 500 down 28. Keep connected DFW for the latest on the situation in the Middle East for updates anytime go to WBAP.com or our free mobile app. On your home for WBAP's morning news weekdays 5 to 9, news talk 820 and 93.3 FM WBAP. I'm Laurie Waffenschmitt. The 60 day countdown is on. What will the US and Iran finally work out the latest developments starting at five? And it's officially summer. We Texans will find out because we could soon see 100 degrees around here. Brad is tracking it all on the ones all morning long. I'm Ernie Brown. Bonnie Cook has your news headlines at the top and bottom of each hour. Julie DeHardy has your traffic and chief meteorologist Brad Barton has your..."
wbap-am-820,76718,1782172849.768133,1782172939.768133,done,26547,3656,AFW news talk traffic and weather station news talk 820 WB AP Fort Worth Dallas 93 3 WB AP FM Halton City Dallas Fort Worth and KPLX HD to Fort Worth Dallas your Texas voice for common sense Trending now military forces remaining in the Middle East. I'm Laurie Waffenschmitt from the 24-hour breaking news center classic chevrolet.com WB AP's first traffic and weather on the one in Arlington an accident blocking two right lanes on 360 northbound at Brown Boulevard Avenue K That's causing stop-and-go traffic from 30 and in Mesquite an accidents been cleared on 635 southbound at Oats Drive But it's still causing stop-and-go traffic from Garland Road Your WB AP forecast from the on-time experts 24-7 weather center I'm Divya pay a meteorologist Cassie hider overnight tonight We're expecting partly cloudy skies with a 20% coverage of rain and storms and temperatures dropping into the mid 70s We're looking for partly sunny skies on Tuesday highs in the mid 90s a 20% coverage of rain and storms We're gonna keep that chance of rain and storms going Tuesday night to Wednesday morning But Wednesday afternoon looks dry and hot with highs in the mid 90s right now 94 degrees in Dallas 95 degrees in Fort Worth despite the White House saying they're working through a deal with Iran military
wbap-am-820,76717,1782172679.4262779,1782172769.4262779,done,26546,1866,"Jump into the hottest stories at thetopicalfruit.com, your go-to spot for stories that keep you in the loop. Hear from some of the most fascinating people in pop culture today. Whether it's Facebook, Instagram, Twitter, and TikTok, news about your favorite stars or studies that will blow your mind, we've got you covered. The Topical Fruit, citrus got real. Follow and listen on your favorite platform. Don't forget to subscribe to our channel and hit the bell so you don't miss our latest videos. We'll see you in the next video."
wbap-am-820,76716,1782172596.4258606,1782172686.4258606,done,26545,4346,"That may sound a little harsh, but I think that's kind of reality. So I wish him well Oh, yeah, it sounds like it for sure that the point being here is that you've got guys like that that are still there until the end of the year and They're basically now said well Donald Trump didn't come in and save me Donald Trump did endorse corn. And so I'm gonna screw Donald Trump every chance I get and Donald Trump went to save act and Donald Trump Wants to have a big victory going in the midterms and I'm not on the ballot because I lost in primary So screw all you guys in fact I really what they're saying is they want Democrats to take control of the Senate Or take control of the house or take control of the house and the Senate that is what they're actually saying here And that's how little they care about Americans Well, let's have a little they care about you and what you voted for they don't respect the voters and so what Thune is now dealing with is he's dealing with a Mutiny of those that were kicked out of office by the American people So, I don't know if they're gonna get anything done the Senate to be honest with you because of the reason I just described to you You get does that make sense? Yeah, it looks to me like it's just going to be business as usual in Washington and we're still going to get nothing done, even though we had the the the Oval Office and the Senate and the House for what a year and a half now and And and it's all going to be for naught because the blue states are going to end up Coming back in and taking power back illegally"
wbap-am-820,76715,1782172496.4935057,1782172586.4935057,done,26544,4480,I'm going to try to find it in my notes because I had this earlier in my notes and it was it was just another example of Trump derangement syndrome. Here I'm going to read this to you okay Cornyn on Rubio and Vance is the front runners for 2028. He said don't tell Ted Cruz that because Ted wants to be the next president like he's so angry that the people in Texas supported Ted Cruz and didn't support Cornyn that he's just really angry even as Cornyn contended he's not a member of the yellow caucus. He made clear that I am free to disagree that might extend to at least one Republican 2020 presidential hopeful. He said he's thinking deeply about the future of his party declining to opine on whether Secretary of State Marco Rubio or Vice President J.D. Vance should carry the banner because I don't want to jinx either one of them. He was clear about his fellow Texas senator but don't tell Ted Cruz that because Ted wants to be the next president. Cruz by the way and this is how bitter he is did not endorse Cornyn for re-election either. Ted's entitled to make his own choices I'm not bitter Cornyn said okay sure people in politics are very competitive and they don't necessarily care a whole lot about anybody else that may sound a little harsh but I think that's kind of reality so I wish him well oh yeah it sounds like it for sure. The point being here is that you've got guys like that that are still there until the end of the year and they basically have now said well Donald Trump didn't come in and save me Donald Trump didn't endorse Cornyn so I'm gonna screw Donald Trump every chance I get and Donald Trump wants to say that.
wbap-am-820,76714,1782172413.4930837,1782172503.4930837,done,26543,4588,"number 1-877-381-3811, 877-381-3811. Let's get your thoughts and your phone calls in here. Let me go to Walt, line three, in Florida. Welcome, you're on the Mark Levin Show, Ben Ferguson with you, hi. Hi, how are you, thank you for taking my call. I'm actually, go ahead. I'm just, I'm beside myself watching what's going on here. I've been hearing statistics of over 80% of America wants the Save America Act, and yet we're sitting on our thumbs and not getting anything done about it. Meanwhile, the blue states are gonna end up taking back power in the midterms, and we're losing our majority and just not really doing anything about it, and they're doing this- Let's talk about the Save Act for a second, why? All right, so, because I think this is, people need to understand why. The reason why the Save Act, and Thune, I actually said this in an interview, I think it was last week. Not an interview, let me rephrase that. He said it by enclosed ordering, got reported on. Thune straight up just came out and said, he's like, hey, I can't get this thing done. I don't have a majority anymore in the Senate because there's a bunch of cranky old Republicans that got kicked out of office. The guy in Louisiana, Cornyn in Texas, the list goes on and on, who are just disgruntled, angry men who are not doing what the American people-"
wbap-am-820,76713,1782172241.8326347,1782172331.8326347,done,26542,3823,"Hi, I'm Joe Salcihi, host of the Stacking Benjamins podcast. Today, we're going to talk about what if you came across $50,000? What would you do? Put it into a tax-advantaged retirement account. The mortgage, that's what we do. Make a down payment on a home. Something nice. Buying a vehicle. A separate bucket for this addition that we're adding. $50,000, I'll buy a new podcast. You'll buy new friends. And we're done. Thanks for playing, everybody. We're out of here. Stacking Benjamins. Follow and listen on your favorite platform. From the Airco AC Heating and Plumbing Studio, this is News Talk 820 WBAP. And now on FM at 93.3. All right, welcome back. It is the Markleman Show. Ben Ferguson with you. And if you just join us, man, we've been talking about a lot of different issues tonight. I want to get to some of your phone calls. The number 1-877-381-3811, 877-381-3811. Let's get your thoughts and your phone calls in here. Let me go to Walt, line 3 in Florida. Welcome. You're on the Markleman Show. Ben Ferguson with you. Hi."
wbap-am-820,76712,1782172158.8321352,1782172248.8321352,done,26541,6162,"The Bob and Tom Show. Women make things up in their heads. Yeah, is that what you're thinking? Have you ever met you? All day, whenever you want. I will complain about the roundabout. A lot of women will pull up and stop. There's nothing coming. I don't know if it's women. I feel like it's more age. Right, you never know. These cars are fast. What are these cars? They fly out of nowhere. Good Lord. People coming at you, all angles? My cousin Dorothy, she got hit. The Bob and Tom Show. Follow and listen on your favorite platform. The Bob and Tom Show. average doesn't grow your business. Smart strategy does. At Cumulus Digital, our campaigns outperform industry benchmarks by more than 25% because we go beyond clicks and impressions, knowing you exactly."
wbap-am-820,76711,1782172058.434629,1782172148.434629,done,26540,4799,"I'll see you next time. My Outro For For My 21st Birthday Jump into the hottest stories at thetopicalfruit.com, your go-to spot for stories that keep you in the loop. from some of the most fascinating people in pop culture."
wbap-am-820,76710,1782171975.4341688,1782172065.4341688,done,26539,3956,"Obama advocated for. You want to know why I had no problem voting for Donald Trump all three times? Look no further than the Supreme Court of the United States of America. Because I understand that there are consequences to elections. And even if you don't like a guy, he may only be there for four years. But look at what he gets to do while he's there for those four years. Look at who he gets to appoint while he is there for those four years. That is the point that people forget. That is the concept that people don't understand. They just look the other way. They're too busy. They don't care. And now all of a sudden, here's another reminder of it. You have a judge now, a Biden radical judge who has just stepped in here and said, uh-uh, I'm going to block Donald Trump's new verification system to remove foreign nationals from the voter rolls. In layman's terms, I am going to make sure that America's elections are not reserved exclusively for American citizens. I'm going to make sure that that that America's elections are infiltrated by anyone that wants to defraud the system. That's what I'm going to do as a judge. And this is exactly why the midterms also matter so much. 877-381-3811, 877-381-3811, Ben Ferguson filling in for Mark Levin. You can also send me your comments during the break on x at Ben Ferguson show."
wbap-am-820,76709,1782171839.0139382,1782171929.0139382,done,26538,3733,against what the laws say on the books because I was put here by an activist I was put here by someone that did not respect the laws the United States America and I don't respect the laws of this country either so I'm going to write an activist paper or which actually is when we rephrase that not a paper it's a ruling and that is what we have now just witnessed it is a ruling a ruling by an activist judge and this is why I say it over and over again but you want to know why elections are so important the damage that is being done to this country even though Joe Biden is no longer in the White House is truly shocking because when you get into power and you are a president whether it's Barack Obama or Joe Biden you get to a point so many different people to office and they get to then continue on your radical legacy for decades and that is not an exaggeration look at the Supreme Court justices who were put in there by hardcore liberals look at their legacy continuing on even what Bill Clinton did what Barack Obama advocated for you want to know why I had no problem voting for Donald Trump all three times I look no further than the Supreme Court of the United States of America because I understand that there are consequences to elections and even if you don't like a guy he may only be there for four years but look at what he gets to do while he's there for those four years look at who he gets to a point while he is there
